{"schemaVersion":"nosfs.task-bundle.v1","taskId":"remission-model","runtime":"micropython","entrypoint":"REMISSION.PY","files":[{"name":"REMISSION.PY","role":"python","sizeBytes":20083,"sha256":"bcafab5aca4dc2e8d879fc77633a68ef9bab9aa14a495469b0730b63efc5ce17"},{"name":"SAMPLE.JSON","role":"json","sizeBytes":228,"sha256":"f3a9affbae0bc5e2688277ba7deb9ae519e604e88e85027800f65b8e2038b890"}],"capabilities":{"network":{"dns":false,"udpDestinations":[],"tcpDestinations":[],"tlsHosts":[]}},"limits":{"memoryBytes":1048576,"runtimeSeconds":30}}
