{"schemaVersion":"nosfs.task-bundle.v1","taskId":"research-analysis","runtime":"micropython","entrypoint":"RESEARCH.PY","files":[{"name":"RESEARCH.PY","role":"python","sizeBytes":10158,"sha256":"b7b9403240f0bd659da2a627c1bb686be3e471d4ac16eba7983d37ad68f22f86"},{"name":"RESEARCH.JSON","role":"json","sizeBytes":1761,"sha256":"289a565aa0f01f9c37b1e61db4461f6a632db99927f4bd56fa974ebe64935770"}],"capabilities":{"network":{"dns":false,"udpDestinations":[],"tcpDestinations":[],"tlsHosts":[]}},"limits":{"memoryBytes":1048576,"runtimeSeconds":30}}
